{"$schema":"https://json-schema.org/draft/2020-12/schema","$id":"https://schemas.procybernetica.local/procybernetica/governance-substrate.v0.1.schema.json","title":"ProCybernetica Governance Substrate v0.1","type":"object","additionalProperties":false,"required":["schema_version","substrate_id","spheres","tokens","policies","attestations","retention_rules"],"properties":{"schema_version":{"const":"0.1.0"},"substrate_id":{"type":"string","minLength":1},"description":{"type":"string"},"spheres":{"type":"array","items":{"$ref":"#/$defs/sphere"},"default":[]},"tokens":{"type":"array","items":{"$ref":"#/$defs/token"},"default":[]},"policies":{"type":"array","items":{"$ref":"#/$defs/policy"},"default":[]},"attestations":{"type":"array","items":{"$ref":"#/$defs/attestation"},"default":[]},"retention_rules":{"type":"array","items":{"$ref":"#/$defs/retention_rule"},"default":[]},"embedding":{"type":"object","additionalProperties":false,"properties":{"full_substrate_ref":{"type":"string"},"embedding_statement":{"const":"W_gov -> W"},"token_invariant":{"const":"T_tokens subset Pi cap C"}},"required":["embedding_statement","token_invariant"]}},"$defs":{"sphere":{"type":"object","additionalProperties":false,"required":["sphere_id","durable_state_ref"],"properties":{"sphere_id":{"type":"string","minLength":1},"label":{"type":"string"},"durable_state_ref":{"type":"string","minLength":1},"parent_sphere_id":{"type":["string","null"]},"metadata":{"type":"object"}}},"token":{"type":"object","additionalProperties":false,"required":["token_id","projection_role","admissibility_role"],"properties":{"token_id":{"type":"string","minLength":1},"label":{"type":"string"},"projection_role":{"type":"object","additionalProperties":false,"required":["scoped_authority_kind","sphere_target","projection_ref"],"properties":{"scoped_authority_kind":{"type":"string","minLength":1},"sphere_target":{"type":"string","minLength":1},"projection_ref":{"type":"string","minLength":1},"expires_at":{"type":["string","null"],"format":"date-time"}}},"admissibility_role":{"type":"object","additionalProperties":false,"required":["policy_constraint_ref","constraint_kind"],"properties":{"policy_constraint_ref":{"type":"string","minLength":1},"constraint_kind":{"type":"string","minLength":1},"admissibility_predicate":{"type":["string","null"]}}},"attestation_refs":{"type":"array","items":{"type":"string"},"default":[]},"token_digest":{"type":["string","null"],"pattern":"^sha256:[a-fA-F0-9]{64}$"}}},"policy":{"type":"object","additionalProperties":false,"required":["policy_id","constraint_ref"],"properties":{"policy_id":{"type":"string","minLength":1},"constraint_ref":{"type":"string","minLength":1},"policy_lattice_ref":{"type":["string","null"]},"version":{"type":["string","null"]}}},"attestation":{"type":"object","additionalProperties":false,"required":["attestation_id","evidence_ref"],"properties":{"attestation_id":{"type":"string","minLength":1},"evidence_ref":{"type":"string","minLength":1},"issuer":{"type":["string","null"]},"payload_digest":{"type":["string","null"],"pattern":"^sha256:[a-fA-F0-9]{64}$"}}},"retention_rule":{"type":"object","additionalProperties":false,"required":["retention_id","policy_ref","theta_ref"],"properties":{"retention_id":{"type":"string","minLength":1},"policy_ref":{"type":"string","minLength":1},"theta_ref":{"type":"string","minLength":1},"duration":{"type":["string","null"]},"disposition":{"type":["string","null"]}}}}}